Statement,Rating
"OFW sa Saudi, instant milyonarya matapos makapulot at maibenta ang meteorite sa halagang P170M",Fake
"Tatay na may malaking bukol sa mukha, matiyagang inaalagaan ng kaniyang misis sa loob ng mahigit 20 taon.",Fake
"Inabandonang aso, natagpuang may kalakip na emosyonal na liham mula sa naghahabiling amo nito.",Fake
 Kilalanin at alamin kung ilan ang mga naging babae sa buhay ni Dolphy ,Fake
"Ang TAGAPAGMANA ni Willie Revillame! Nag-iisang anak na Lalaki ni Willie, ipinakilala na sa publiko",Fake
"73-anyos na lolo, matiyagang nag-apply at kalauna'y natanggap bilang call center agent!",Fake
"John Lapus, kilala raw ang troll na tinutukoy ni Vice Ganda",Fake
"Inang walang maipang-bili ng gatas, tanging dinurog na saging ang pinapakain sa kanyang kambal na sanggol",Fake
" Guro, naiyak nang makita ang 3-estudyante habang kumakain: ""Subo ng maraming kanin, kurot sa kaunting ulam""",Fake
" Ninang na hindi makapagbigay ng 1k na pamasko, tinawag na madamot ng kanyang kumare",Fake
"Dating 'service crew', ngayon ay libu-libong tao na ang tinutulungan at ginagabayan para maging matagumpay na negosyante.",Fake
"MMDA noon, negosyante na ngayon! 60k-90k na kita buwan buwan, pagbabasa lang ng libro ang puhunan.",Fake
Negosyo para kay Lolo! Wendell Ramos Binigyan ng Sariling Mangga at Food Cart si Lolo Narding,Fake
"Beteranang aktres na si Gina Pareño, minsan ding naging Darna",Fake
"Vice Ganda may pasaring sa mga politiko: ""Yung mga politikong ang yayaman na, nagnanakaw pa…”",Fake
"Lalaking kinantyawan na may C0V1D, umakyat sa poste ng kuryente",Fake
"“KIKO/RISA TANDEM KASADO na sa 2028/LENI ROBREDO NILAGLAG!KIKO NATALO daw SIYA DAHIL sa FAKE NEWS!”
",Fake
"Isang ama, binawian ng buhay sa kalagitnaan ng pagtatrabaho dahil sa sobrang pagod.",Fake
Milk tea pearls nakita sa loob ng tiyan ng 14-years old na babae,Fake
"Babaeng nag-viral dahil sa kakaibang karamdaman, napangiti dahil sa tulong na natanggap",Fake
"Manager ng isang Fast Food, ibinulgar ang inaatupag ng isang delivery rider sa halip na ihatid kaagad ang order ng customer.",Fake
"10-anyos na batang naglalakad gamit ang kaniyang mga kamay, hirap man ay patuloy pa rin na nangangarap sa buhay.",Fake
"Dennis Padilla sa naging hiwalayan nila ni Marjorie Barreto noon: ""I'm the one to blame""",Fake
"Bomber Moran, naging Caregiver sa Amerika matapos humina ang karera sa showbiz, alamin ang tunay na nangyari sa kanyang buhay",Fake
"Ruffa, nawindang sa sinabi ni Yilmaz na maaaring pumunta ng Istanbul kasama ang pamilya at ka-date: ""Bisita sya pero...""",Fake
"Ama ni Raffa ‘di pine-pressure si Joaquin na pakasalan ang anak, ‘Sabi ko, ‘When you’re ready!”",Fake
"Love Story noon nila Leo Martinez and Cherie Gil, Ikinagulat ng Netizens! Ano nga ba ang tunay na kwento?",Fake
"""Invisible 50"" ipon challenge ng isang misis, umabot sa 65K sa loob lamang ng 3 buwan",Fake
,Fake
"Anthony Taberna's Daughter na si Zoey, Cancer-Free na: ""I thought that my life would end at 13 years old""",Fake
"“MAY KUMAKALAT NGAYON NA NAMIMIGAY DAW NG VITAMINS PERO ANG LAMAN NG VITAMINS AY VETSIN.. TANDAAN NYO PO KUNG MAY MAMIMIGAY NG VITAMINS  MAS MABUTING SURIIN MUNA BAGO ITO INUMIN”
",Fake
Leon Baretto binasag ang katahimikan tungkol sa relasyon nilang magkakapatid sa amang si Dennis Padilla,Fake
"Guro, hindi hinayaang mag martsa sa entablado ang isang estudyanteng naka 'scotch-tape' lang ang sapatos!",Fake
"Inuupahang bahay ng buntis, tinanggalan ng bubong at pinto matapos hindi makapagbayad ng renta",Fake
No Award? No problem! 'Cash Sash' Galing kay Nanay sa Graduation ang Answer!,Fake
"11 years since AJ Perez left, late actor’s younger bro continues to make him part of every milestone he reaches",Fake
"Ruffa sa PagpapaKasal Muli: ""I don't know if I want to get married again. All I know is, I’m not going to end up alone.""",Fake
"Keempee De Leon, ibinahagi kung sino-sino ang kanyang mga naging kasintahan sa showbiz",Fake
Pangmalakasang kuhang mga larawan sa kasal hagalpak na goodvibes ang hatid sa mga netizen sa social media,Fake
"Lalakeng natagpuang nakahandusay sa kalsada, ginulat at napahalakhak ang lahat ng ito'y biglang bumangon.",Fake
"Mensahe ni Jose Hallorina kay Donnalyn Bartolome: ""Napaka sinungaling mong tao, nakakatakot ka""",Fake
"Never ignore the little things, sometimes they matter more",Fake
“24 ORAS EXPRESS REGALO NG RUSSIA NASA MINDANAO NA ! PILIPINAS VINES NEWS VIRAL).”,Fake
Ang Galing! Kauna-unahang babaeng Igorot na nakapagtapos sa Royal Military College of Canada.,Fake
"Dalaga, Hinawak-Hawakan at Pinisil-Pisil sa Legs ng Taxi Driver, Viral!",Fake
" Vice Ganda, sinagot ang open letter sa kanya ng isang guro",Fake
"Rica Peralejo, may reaksyon patungkol sa simbahang nagba-'bloc voting'",Fake
"Lalaking nagkatrangkaso, hindi inasahan ang dalang prutas na bigay ng kaibigan",Fake
"Netizen, Ibinahagi ang Pagka-Dismaya sa isang Catering Service: ""40k! MERON PANG ISANG KALDERO NG KANIN NA BAWAS NA!""",Fake
"Mag-asawa, nagulat nang magpakilala sa kanila ang isang Jollibee service crew",Fake
"Bride, nakatanggap ng kapa at koronang gawa sa limpak-limpak na pera mula sa kapatid na OFW.",Fake
Isang Filipino artist na gumagamit ng mga ginupit na plastic at recycled materials sa kanyang obra agaw pansin sa social media,Fake
"Mag-asawang may 59-iskolars, todo suporta sa kaliwa't kanang pagtatapos ng mga estudyante",Fake
"“PBBM Pambansang Pabahay Para sa Pilipino Program. 6 Million Pabahay ang itatayo ni PBBM, at nag uumpisa na kaming mag lista ng mga makakasama..SA MGA GUSTO MAG PALISTA ONLINE REGISTRATION MAG PALISTA DITO.”
",Fake
"Mga nagkalat na papel, mga liham pala ng mga preso na may pakiusap sa sinomang makakapulot",Fake
"Pulubing ama na nagbebenta ng ballpen noon, ibang-iba na ang buhay ngayon",Fake
"“Kidney stones, kidney failure, physiological weakness, nocturia, masakit na pag-ihi, insomnia, pananakit ng likod, pamamaga ng mga kamay at paa agad gumamit ng Neypro 1 Gold .”",Fake
"Foreigner, naging palaboy matapos umanong tangayin ng isang pinay lahat ng kanyang pera",Fake
"""UTOT for SALE!"" Isang sikat na Amerikana ang kumita ng $200,000 dahil sa pagbebenta ng kanyang utot.",Fake
"“Clinical trial po ito. More than 10,000 pong mga kabataan ang sinaksakan dito. Napakababa po ng efficacy, 56% lang. At six out of 10 na sasaksakan mo ng Dengvaxia ay magsa-suffer ng severe adverse effects, anim out of 10.”

Source: TeleRadyo, PAO binatikos ang panawagang gamitin ulit ang Dengvaxia sa kabila ng rising dengue cases, watch from 5:06 – 5:28",Fake
"Naipundar na Mansion ni Dating Fernando Poe Jr. at asawang si Susan Roces, ipinasilip sa publiko",Fake
"Amalayer, ibinahagi ang nakakalungkot na pangyayari sa kanyang buhay matapos ang viral video",Fake
"Traffic enforcer pinuri ng mga netizens: “Sana lahat ng traffic enforcer kagaya mo kuya""",Fake
"Car Driver, Matapos Magpa-Full Tank, Hindi Nagbayad at Tinakbuhan ang Gas Station!",Fake
"“Ay, na-post! Thank you, Manay Loida Nicolas Lewis for the invite for #LenLen in Harvard! See the connection?” ‘It doesn’t have to be true. It just need  to look like it.’ #AlamNaThis #KayaPala #Budol #Scam #PangUuto #Panlilinlang #Panloloko #Pambubudol.”
 to look like it.’ #NowWeKnow #That’sWhy #Swindle #Scam #Misleading #Deceiving #Fraud.)",Fake
 Sen. Chiz Escudero at Heart Evangelista hiwalay na? Heart hindi na raw suot ang wedding ring,Fake
"73 Anyos na Lola, Patuloy na Kumakayod sa Paglalako ng Ice Cream para sa kanyang Pamilya",Fake
"Single mom Geneva Cruz, pumalag matapos sabihang 'matanda na' at 'maitim ang singit.'",Fake
"Inang balut vendor, tinanggihan ang bigay na house and lot ng kanyang anak",Fake
"Lolong basurero, ninakaw ang maliit na kita pero nagawa paring itulong ang natirang P5-barya",Fake
"Tignan ang eleganteng mala-palasyong bahay ni ""Megastar"" Sharon Cuneta, nag-iisa lang sa Pilipinas",Fake
"Bike na araw-araw tinatawaran ng lolo sa shop, iniregalo ng tindera sa matanda",Fake
"Buwis-Buhay na Pagtawid sa Tulay na Lubid ng Isang Babaeng may Buhat na Bata, Viral!",Fake
,Fake
"Lola nagtitinda ng BBQ stick sa halagang P25 na kita kada araw, mag-isang tinataguyod ang anak na PWD at apo nito",Fake
" ""Hindi Grades o Diploma Ang Batayan,"" Negosyanteng diskarte, sipag at dasal ang naging puhunan sa tagumpay",Fake
"Malamansyon na tatlong palapag na bahay ni Kris Aquino, sa wakas ay ipinasilip na sa publiko",Fake
"Scammer na Nagpanggap na Konsehal, Walang-awang Biniktima ang Small Business ng isang Cancer Patient",Fake
"Matandang tindero na may kapansanan, ipinanawagan ng isang netizen na tulungan",Fake
Lolit Solis ibinunyag ang dahilan kung bakit ayaw raw ni Ivana kina Derek at Gerald,Fake
,Fake
"'Linuyang Cake' ni nanay para sa kaniyang anak, umantig sa puso ng mga netizen.",Fake
"Lalaking buhay binata sa Canada, hindi na nga nagbibigay ng sustento sa anak, nambababae pa",Fake
" Ogie Diaz rumesbak sa mga pahayag ni Liza Soberano: ""Tingnan natin kung sinong mas tama nga sa darating na araw""",Fake
"WARNING!

SMNI strongly disowns this fake quote card circulating in social media. We assure the public that SMNI will only deliver ‘Truth That Matters’. pic.twitter.com/kvW4BrOaKS
— SMNI News  January 8, 2023",Fake
Kilalanin ang iconic na kontrabidang si Bella Flores: Ang batayan ng pagiging kontrabida,Fake
"Panglinis ng lababo na nabili online, sumabóg sa mukha ng isang mamimili! ",Fake
"‘Abot-kamay na sana!’ Numerong tinayaan ng isang lalaki sa 6D lotto, lumabas; olats pa rin",Fake
" Dating kasintahan ibinahagi kung gaano kabait, supportive na tao si Christine, taliwas sa panghuhusga ng marami",Fake
“KAKAPASOK LANG BAGONG UTOS PRES MARCOS SUBPOENA BlNASURA GENERAL BANTAG SOJ REMULLA CATAPANG NANLUMO ”,Fake
"""Sana ako din na asawa mo,"" saloobin ni misis sa mister na laging inuuna ang sariling kaligayahan at ibang tao",Fake
"Ang biglang sikat na construction worker sa Davao de Oro na ka-lookalike ni Jericho Rosales, kilalanin! ",Fake
"Did you know? In the age of dating apps, a groom market that started 700 years back still exists",Fake
"Tatay na galing trabaho, sabik na binili ang pasalubong sa anak kahit nanlilimahid pa ang mga paa nito.",Fake
“GOOD NEWS AGE 40 PATAAS PWEDE NA MAGPENSYON  WOW PINAKAMALAKING BANGKO SA PILIPINAS PBBM BINUBUO NA  Live Today.”,Fake
Bagong modus ng mga kawatan! Netizen nagbigay ng payo sa mga kapwa motorista,Fake
"“Yeah, well at least 8.1 nag-increase lang ng  0.1 [%] and the rate of increase is slowing.”
Source: Office of the Press Secretary, Official transcript of President Ferdinand R. Marcos Jr. at the Kapihan with the Media , Jan. 5, 2023",Fake
" Estudyante, humingi ng pabor na ""lakihan"" ang nakuhang mababang marka: “Teacher tayo nak, hindi magician,”",Fake
Babae ginawang facemask ang kanyang 'panty' matapos palabasin ng guard sa supermarket,Fake
"Isang kawawang ina, pinagpapalo ng tabla ng sariling anak hanggang sa masira ito",Fake
 Karla Estrada may pinariringgan?: “Araw-araw kong lilinisin ang basura sa bakuran ko bago ako magmalinis sa tingin ng iba”,Fake
"Larawan nila Cheska Garcia, kinaaliwan matapos makita ang malagkit niyang tingin sa braso ng kanyang asawa.",Fake
"Mag-asawang Basurero na 2 Days ng Hindi Kumain, Tinulungan ng Good Samaritan Kahit Last Money na lang ang Laman ng Bulsa!",Fake
"Ama at sanggol na nakikipagsapalaran sa gitna ng kalsada, himalang nakatanggap ng tulong mula sa isang ""good samaritan""",Fake
"Misis ni Vhong Navarro, binasag na ang katahimikan patungkol sa kaso ng kanyang asawa",Fake
"Kahit sa gitna ng dagat, may ayuda! PCG, namahagi ng tulong sa mga mangingisda.",Fake
" Showtime contestant binira ang programa: ""Sa halagang 5K, nilalaglag niyo ang pagkatao ko""",Fake
"Pagmamahal at sakripisyo ng isang Ina, pasan ang may kapansanang anak hanggang nagtapos ng kolehiyo",Fake
" Jollibee crew na umiiyak matapos sigawan ng customer, umani ng simpatya sa mga netizens",Fake
"Mag-asawa sa England planong mag around-the-world tour, matapos manalo sa UK lottery ng £184 o halos ₱12 bilyon",Fake
"Isang vlogger nagpahalik ng paa sa matandang tindero kapalit ang P3000, ginulat ang mga netizens",Fake
"Lalaking nagpa-tattoo nang hindi pinahintulan ng kanyang ama, viral",Fake
"Pambababae ng Sikat na Vlogger, Ibinulgar ng Netizen na Hinalikan Diumano Nito!",Fake
 Glydel Mercado lumapit sa albularyo matapos umanong ipakulam ng kamag-anak,Fake
" Lolo na na-stroke, tuloy parin ang paglalako ng isda kahit hirap na hirap sa paglalakad masuportahan lamang ang apo",Fake
“KAKAPASOK LANG UMAMIN NA! CAYETANO NAMUTLA sa TAKOT hindi NAKALIGTAS kay PRES BBM SENADO SININGIL NA ”,Fake
"Sa kabila ng kapansanan, Isang ama ang patuloy na kumakayod bilang fishball vendor para maitaguyod ang pamilya",Fake
" Larawan ng isang inang inabandona umano ng kanyang pamilya, dinurog ang puso ng mga netizens",Fake
PANOORIN: Mga bagong CCTV footage sa hotel hallway na nakita si Christine Dacera,Fake
" Magna Cum Laude graduate, hindi umano sadya at intensyon ang mangopya; Sagot ng may-ari 'still plagiarism'",Fake
"Sweet na sweet na larawan umano ni Jeric Gonzales kasama ang kapwa lalaki, kalat na kalat sa social media",Fake
"Kandidata ng Binibining Pilipinas na nagbihis Mama Mary, nagpataas ng kilay sa ilang mga netizens!",Fake
" Isang ina, 12hrs nagtatrabaho sa kilalang burger stalls kapalit lamang ang P200 na sweldo",Fake
"Kyut na kyut na aso, halakhak ang dinulot nang masaktuhang pinaglalaruan ang pustiso ng kanyang amo.",Fake
"Mga sariwang gulay, bumida sa isang kasalan bilang dekorasyon at giveaways.",Fake
"Dating pulis sa Pilipinas, naging delivery boy at cleaner sa ibang bansa bago naging ganap na Royal Canadian Police",Fake
"'Ipinadampot at pinalabas ng gate dis oras ng gabi!' Guanzon, inilahad ang panig ng dating mga kasambahay nila Ruffa Gutierrez",Fake
"Isla sa Bohol kung saan dinadala ang mga pusang ligaw, nirespondehan ng isang animal lovers group.",Fake
"Mga larawan ng mga napalabang kababaihan sa tradisyonal na 'bouquet toss' sa isang kasalan sa Cebu, Viral!",Fake
" Netizen, sinuwerte at nagulat sa halaga ng alahas na nakuha mula sa nabiling ukay-ukay",Fake
Mga rebelasyon tungkol sa hunk model na si Borgy Manotoc at nasaan na nga ba ito ngayon?,Fake
" Isang anak, nanawagan kay Raffy Tulfo matapos bugbugin ng kapitbahay at tanod ang kanyang tatay na 79years old",Fake
"Isang higanteng lapu-lapu, nahuli sa Antique: Umabot ng 187 kilos, inabot ng limang oras bago naiahon mula sa dagat",Fake
"Tamang paraan ng pagtanggal ng garapata na dumikit sa balat, itinuro ng concerned mom",Fake
"Lalaking kinuwestiyon at pinangaralan ang babaeng nabuntis kahit may pandemîc, inulan ng batikos",Fake
"Paghingi ng Tulong Pinansiyal ng Pamilya ni Pen Medina, Inokray ng Netizens!",Fake
"Vegetable vendor, panalo bilang Mayor ng Dolores, Samar; Tinalo ang isang doctor",Fake
"Netizen, problemado sa utang ng barkadang ginamit ang pangalan niya upang ma-aprub sa loan",Fake
" Mag-asawang nagtiyaga sa pagbebenta ng kwek-kwek, nakapag-ipon at nakapundar ng sariling lupa at sasakyan",Fake
Ano nga ba ang kwento sa likod ng kahindik-hindik na nangyari sa beteranang aktres na si Nida Blanca,Fake
 Maricel Soriano tinanggihan ang isang pelikula dahil ayaw umano ni Dolphy,Fake
" Hidilyn Diaz, sinagot ng dalawang netizen magtapos magkomento na magtatanim na lang ng sibuyas",Fake
"Filipino Doctor, Minaliit ng Filipino Nurse na nasa US, Tinawag na 'Careless 3rd World Healthcare Worker'",Fake
"Marites sa Jeep, Spotted! Netizen na Nakikibasa ng Text ng Katabi, Nagpaaliw sa Netizens!",Fake
"Estudyante, mangiyak-ngiyak nang makatanggap ng laptop mula sa fundraiser ng kanyang dating guro",Fake
Lettuce na 20 Pesos isang kilo? Lugi ba ang tindero o panalo?,Fake
" Nakatiwangwang na ginagawang kalsada, tinaniman ng mga halaman ng isang netizen",Fake
Dalaga pa rin daw manamit at pumorma kahit may anak na! Hindi naman masama ang mag-ayos diba?,Fake
"Batang kaya pala nananahimik sa isang tabi, patago palang ngumunguya ng patuka ng manok.",Fake
" Bakit dapat mo piliin magmahal ng isang dayuhan? Pinay, inilatag ang napakaraming dahilan",Fake
"Isang ginang hinangaan matapos makaipon ng P160,500 sa pagtitinda ng ice candy",Fake
"Komedyanteng si Dagul, hindi na nakakalakad at umiiyak na ibinahagi ang kanyang buhay ngayon ",Fake
Alamin ang mahalagang benepisyo ng 'Lemongrass' o Tanglad sa ating kalusugan pati na rin ang iba pang gamit nito.,Fake
"2-taong-gulang na bata, imbes na gatas, sigarilyo ang hanap mula pa 18 mos. old",Fake
"“Bilib ako sa iyong liderato, puro Garcia . Sa amin man rin . You know there is a queer coincidence in our history. Maybe it would be the first time; I don’t know. I have yet to look into the archives of our country; but si Inday [Sara] … would swear sa  loyalty niya sa  Constitution and to the country ngayong  [June] 19.”",Fake
"Jennica Garcia, naging emosyonal nang ibahagi ang pagpapahalaga sa kanya ng ina nitong si Jean Garcia.",Fake
"6-yr old na bata, takot ng pumasok dahil 'natrauma' sa ginawa ng Guro; Magulang may pakiusap!",Fake
"BEWARE: Lucky Me Pancit Canton Has A Health Destructing Content, Leading People To Serious And Fatal Diseases ",Fake
Sino nga ba si Pepsi Paloma at Bakit buhay pa rin siya sa Alaala ng publiko kahit 37 taon na matapos pumanaw?,Fake
‘Real-life Rapunzel’ has been avoiding haircut since 2003,Fake
" Mala game show na pa-birthday ng anak, nagregalo ng isang milyong piso sa kanyang ina",Fake
"Muling balikan, Ruffa and Yilmaz's modern fairytale love story: 'I asked where she lives, why she's here, what's here name'",Fake
"Pustisong inorder online, umani ng kilig at katatawanan dahil sa hatid nitong mahiwagang smile.",Fake
" 89-anyos na lola, nagtitinda ng basahan para ipang tustos sa kanyang mga apo",Fake
" “Waiter ka lang pala?” Minamaliit na waiter, nakapagpatayo ng malaki at eleganteng bahay",Fake
 Alamin ang kwento ng buhay ng OPM Legend na si Fred Panopio at ang dahilan ng pagpanaw nito,Fake
Misis ng isang Seaman kinuwestiyon ang 75K allotment; Hirap umanong pagkasyahin sa mga gastusin,Fake
"Anak, aksidenteng nabasa ang mga mensahe ng kaniyang ina sa namayapang ama.",Fake
Good Samaritan to the Rescue sa Batang Bumibili ng Birthday Cake para sa Nanay! ,Fake
" Janno Gibbs, itinanggi na siya ang lalaking nag-ala Jim Paredes sa isang video: ""Hind ako yun""",Fake
Tahong vendor nagsauli ng bag na may lamang P15 Million na tseke,Fake
"Batang magtatatlong taong gulang pa lang, May Ipon ng 77k!",Fake
"Ruffa Gutierrez nataranta at di nakatulog dahil sa offer sa kanya: ""I was too perplexed thinking about his offer...""",Fake
"Bumili lang ng 1 deodorant! 60-anyos, napahiya matapos mapagkamalang nag-'shoplift' sa isang kilalang grocery store.",Fake
"Larawan ng dalawang batang magkapatid na namamalimos habang nakasuot ng plastik, dinurog ang puso ng mga netizens",Fake
Silipin ang tahimik at masayang buhay ni Ate Glow sa UK kasama ang kanyang British husband matapos lisanin ang showbiz,Fake
"Isang ama, idinaan sa pagra-rap ang paghingi ng tulong para sa kanyang may sak!t na anak.",Fake
 Magkapatid magkasalo sa isang Lalaki: “Mahirap pumili. Mahal ko sila pareho.”,Fake
"Dalawang Paslit, natagpuang natutulog sa kariton na siya mismong tindahan ng kanilang ina.",Fake
"Veteran Journalist on Liza Soberano's Latest Revelation: ""SIKAT KA NGA, PERO IBA ANG YUMAMAN SA KINITA MO.""",Fake
"Guro, ipinahiya at pinahirapan ang estudyanteng humingi lang ng kaunting konsiderasyon makapasa lang",Fake
"Babaeng inakalang patay at nasa loob na ng kabaong, nagising bago i-cremate",Fake
"Tongs na naiwan sa isang kubeta, winindang ang isipan ng netizens online",Fake
"4 year old na bata, ginuhitan ang passport; Tatay na-stuck sa South Korea",Fake
"Handa ka na ba? NETFLIX, may bago na namang pang-blockbuster na series",Fake
"""Lolo Vlogger"", ipinagdiwang ang pagkakaroon ng 300 subscribers. Biglang pumalo sa halos 50k matapos maghanda ng pancit!",Fake
"Ito na pala si Onyok ngayon, binata na at sobrang laki ng kanyang ipinagbago",Fake
" Mag-asawa mula sa Cebu, nagtayo ng dalawang paaralan; libre ang tuition at uniforms",Fake
"Tropang hindi isinama sa 'bonding', nag-text at nagsumbong sa barangay!",Fake
"Gwapong Amerikano na dumulog kay Tulfo, natipuhan ang isa sa mga staff ng programa",Fake
"Babae, naoperahan sa appendix matapos 2 yrs magpigil ng utot tuwing kasama ang BF dahil nahihiya raw syang gawin ito",Fake
"Isa nanamang PCG frontliner sa NAIA ang nagbalik ng halagang 100,000 libong piso sa ating kababayang OFW.",Fake
British blogger sumulat ng isang open letter bilang paghanga sa viral Pinoy rapper na si Ez Mil,Fake
"Rendon Labador binanatan si Alex Gonzaga: ""Wala kang pinag-aralan""",Fake
" Customer niloko ng isang delivery rider: ""Naniwala ako dahil naawa ako""",Fake
"Taxi Driver Nag Sauli ng Mobile Phone sa kanyang Pasahero, Inulan ng Papuri!",Fake
"Video ni Jhong Hilario na nadulas sa stage ng It's Showtime, trending online!",Fake
"Propesor, umani ng papuri matapos alagaan ang anak ng kanyang estudyante upang makapag-focus ito sa exam",Fake
Lola mag-isang kumakayod sa paninimot ng tira-tirang palay para may maisasaing,Fake
" Cong. Lucy Torres, ibinahagi ang dahilan kung bakit siya tumigil sa pagkain ng manok",Fake
" Pinay caregiver mula sa Canada, tinawag na “hero nanny” matapos mailigtas ang buhay ng 2 alaga.",Fake
“Goodnews! Marcos Wealth ipopondo na para sa sambayanang Pilipino! 6M units pabahay ni PBBM nag-umpisa na !”,Fake
"Iminumungkahing Face to Face Classes Pilot Run, Kinder to Grade 3 Students ang Isasabak",Fake
"Isang Ina, nakulong matapos mahuling nagnakaw ng panghanda sa kaarawan ng anak",Fake
"Netizen, Dismayado sa Inasal ng isang Guro sa Estudyante nito: ""Isasampal ang grading sheet? Just wow.""",Fake
Kahanga-hanga! Netizens Napa-Wow sa Customer dahil sa Ginawa nito sa Crew na Nakatapon ng Pagkain nila!,Fake
Estudyante hinimatay sa pagod habang umaakyat sa bundok para makahanap lang ng signal,Fake
"Isang guro, ikinagulat ang natuklasan tungkol sa jeepney driver na nasakyan niya",Fake
"Ruffa, sa araw-araw daw niyang pag-iyak nang magkita si Yilmaz at mga anak: ""It’s always a beautiful and touching moment when families reunite""",Fake
"Mikee Morada may mensahe para sa pinagdadaanan ng asawa: ""Nandito ako para sayo. Maghihilom din ang lahat,""",Fake
"Isang tindera, binahagi na kumikita ang isang Badjao ng P500 sa ilang oras na 'kalabit-penge'",Fake
"Babae ikinulong dahil may problema sa pagiisip, magulang humihingi ng tulong na maipagamot ang anak",Fake
" Estudyanteng wala ng maipambili ng pagkain, humingi ng tulong sa kanyang teacher",Fake
"Bago si Annabelle Rama, sya raw ang babaeng labis na minahal ni Eddie Gutierrez na nagbunga pa ng isang supling",Fake
"Toni Rose Gayda, matinding pagsubok sa buhay pala ang nilagpasan. Sobrang blessed sa kanyang inang si Rosa Rosal. ",Fake
 Rendon Labador binigyan ng payo ang dating aktor na si John Regala,Fake
To the Rescue! Delivery Rider Naging Life Saver ng Isang Customer na Inatake ng Asthma,Fake
Traffic enforcer umani ng papuri dahil sa patuloy na trabaho sa kasagsagan ng baha at ulan,Fake
"Batang Ina, ibinahagi kung paano nakapagtapos ng kolehiyo habang kasamang pumapasok ang 2-anyos na anak!",Fake
"Bagong silang na sanggol, nahiwa ng doktor ang mukha matapos gawin ang C-section operation",Fake
"Matataas na standards ng mga kompanya, pero mababang pasahod dahilan ng pag-aabroad ng mga Pinoy- Netizen",Fake
“KAPAPASOK LANG! MATINDI TO! SARAD0 na! PASTOR QUIBULOY SUMAB0G sa GALIT UP DILIMAN GUSTONG IPASA-RA !”,Fake
"Sharon Cuneta, naglakas loob na tumaya sa Lotto: 'for the first time ever ako ang nagpunta sa store at pumili ng numbers!'",Fake
Pilipino sa Japan pinarangalan bilang pagkilala sa kabutihang ginawa para sa isang Haponesa,Fake
" Pagliligtas ng pulis sa isang babaeng tatalon sa tulay, kuha sa video; Mga netizens todo puri",Fake
"Dating taga hugas ng plato na ang sahod ay 80 pesos kada araw, may payo sa mga taong nayayabangan sa kanya!",Fake
" Kaibigang pinagkatiwalaan, tinangay ang mahigit kalahating milyong renta sa apartment",Fake
"Mabait na Guro, binastos at minura ng kanyang mga estudyante dahil lang sa isang module",Fake
"Alagang aso bakas ang lungkot sa pagpanaw ng kanyang amo, nakaabang at naghihintay lamang sa higaan nito",Fake
"10 taong gulang na batang babae, ginampanan ang pagiging magulang sa dalawang kapatid matapos iwan ng ina.",Fake
"“Breaking news! Pilipinas, magkaka-nuclear na! Biden, nakaplano na ang uumpisahang deal kasama si President Ferdinand Marcos Jr. tungkol sa itatayong nuclear facility sa Pilipinas !”",Fake
Babae isinugod sa ospital dahil sa sobrang pagkain ng maaanghang at pag-inom ng milk tea,Fake
"Viral Student/Taho Vendor na si Gurprit, binagyo ng ayuda mula sa mga negosyanteng nakasaksi sa kanyang kasipagan.",Fake
"Dating sikat na aktres, ginulat ang mga pinoy sa bagong trabaho nito sa Amerika!",Fake
" Babaeng umorder ng TV sa isang online store, isang sulat at USB cord ang natanggap",Fake
"Batang tanging kamote lang ang kinakain, Kinurot ang puso ng mga netizen: ""Wag kayong tamarin. Maawa kayo sa mga magulang niyo""",Fake
"Isang lalaki nakalikha ng magagandang bags mula sa basurang lata ng softdrinks, dinagsa ng mga parokyano",Fake
"“Despite the challenges of the pandemic and the global economic upheavals, we remain on track to reach upper middle-income status by next year. With steady investments in food, public health, education, and other social services, we expect to become a moderately prosperous country by 2040. I am confident that we will achieve this vision.”
Source: RTVMalacañang, Statement at the 77th Session of the UNGA General Debate  9/20/2022, Sept. 21, 2022",Fake
"Lalaking nambastos, siya pa ang galit at nagwawala",Fake
"Juliana Gomez, minsan na ring inakala na siya'y ampon dahil tila naiiba ang itsura niya sa mga magulang.",Fake
" Batang itinaboy habang nagbebenta ng sampaguita, tinulungan ng isang napakabuting Netizen",Fake
