Statement,Rating
"2 pang bansa, nag-alok na mag-donate ng bivalent vaccines sa Pilipinas",Real
KBYN: 65 anyos na bulag may payo tungkol sa buhay,Real
"Maraming South Koreans, ayaw nang magsuot ng face mask dahil natatago ang kanilang kagandahan &ndash; pag-aaral",Real
BGC bilang parte ng Taguig City lalong pinagtibay ng Supreme Court,Real
Pagganap ni Piolo Pascual sa 'Ibarra' ipinasilip,Real
"Pagbibigay ng AstraZeneca Covid-19 vaccines sa Pilipinas, hindi ihihinto – DOH, FDA",Real
"Gobyerno, tinitingnan ang extension ng Malampaya gas field operation na magtatapos ang life cycle sa 2027",Real
"DMW: mahigit 80 Japanese employers, planong mag-hire ng maraming Pinoy skilled workers",Real
"Mayor Isko, pinayagan na sa 10% capacity sa mga simbahan sa Maynila",Real
DepEd ipapasa sa OSG ang pagsampa ng kaso vs opisyal re: overpriced laptops,Real
"Bakuna ng Vietnam vs ASF, subukan!",Real
"Rider na nanutok ng baril sa traffic enforcer at nahulihan pa ng droga, arestado sa Makati",Real
"May nanalo ulit sa lotto; higit P18-M jackpot sa 6/49 draw, nasolo",Real
"LEDAC, itinutulak ang ratipikasyon ng RCEP at pagpasa ng 10 priority bills",Real
Bata tumutulong sa mahihirap na estudyante sa pamamagitan ng pagpinta,Real
Higit 100 bahay natupok sa Calbayog,Real
'Dumarami ang kabataan sa mga nagpapatulong sa mental health',Real
"Nakababahalang pagtaas ng kaso ng bullying sa bansa, paiimbestigahan na sa Senado",Real
"Vice Mayor ng Aparri, 5 iba pa patay sa ambush sa Nueva Vizcaya",Real
"Sen. Padilla, ipinagtanggol sa mga kritiko ang isinusulong na pag amyenda sa economic provision ng 1987 Constitution",Real
Youth unemployment nananatiling mataas,Real
Bongbong Marcos inspirasyon ang ‘Ant-Man’ sa pagtakbo bilang presidente,Real
Tim Connor ‘umatake’ sa post ni Maggie Wilson: Wear a condom before filing an adultery charge,Real
Japan magbibigay ng isang milyong AstraZeneca vaccines sa Pilipinas,Real
"VP Leni kay Rep. Boying Remulla: Kung may pruweba, ilabas na",Real
"Romualdez, hiniling sa DMW na gumawa ng hakbang upang maalis ang placement fee sa mga Pilipino na nais na magtrabaho sa Japan",Real
"63 sugatan sa magnitude 6.4 na lindol sa Abra, pagyanig umabot sa Metro Manila",Real
"Mahigit P3-M 'shabu', nasabat sa Pasay drug bust; suspek arestado",Real
Naulila sa Servando hazing may payo sa pamilya Salilig,Real
"Lalaki sa QC na bumili ng nakaw na motorsiklo at nahulihan din ng sumpak, arestado",Real
Pagtakbo ni Alfred sa 2022 palaisipan pa rin; naging emosyonal dahil sa kapatid,Real
"Diesel prices to drop; gas, kerosene prices to rise in mid-April",Real
DOH: Aabot sa 44-M ang nasayang na bakuna kontra COVID-19,Real
"Higit P1/L na tapyas sa mga produktong petrolyo, posible umano sa susunod na linggo",Real
"Speaker Romualdez, nais matiyak ang kahandaan ng gobyerno para sa Big One",Real
"Senador, nanawagan ng full blown audit sa mga ginastos ng gobyerno sa Covid-19 vaccines",Real
"Mga pedestrian at motorista, ginulantang ng malakas na pagsabog sa China",Real
"Pulis, arestado dahil umano sa pangongotong sa tao na kaniyang inaresto",Real
"BIR: Last day ng filing ng ITR, walang mahabang pila dahil sa online payment",Real
"13-anyos na estudyante na pauwi galing paaralan, patay sa pamamaril sa Cotabato",Real
"PBA, DILG sanib-puwersa sa laban kontra droga",Real
Pagtanggap ng iba pang requirements para sa SIM registration pinag-aaralan,Real
Veteran sports broadcaster Boyet Sison pumanaw sa edad na 58,Real
"Presyo ng bigas tumaas nang P2 sa ilang pamilihan, Kadiwa",Real
Bahagi ng Roxas Boulevard na papunta sa Rizal Park isasara sa Dec. 30,Real
"MMDA, tuloy-tuloy ang paghahanda laban sa pinangangambahang ‘Big One’",Real
Cardinal Tagle sa pagsibak sa kanya sa Caritas: A process of humility and discernment,Real
DOH: 2nd COVID-19 booster shot aprubado na sa 'general population',Real
Socmed influencer FLM hindi aatras sa pagtakbong senador; mga tagasuporta nag-grand caravan sa Metro Manila,Real
"Lotto winner, ginawang ala-Bingo ang pagpili sa tinayaang lucky number",Real
"3 suspek umano sa panghoholdap, naaresto sa tulong ng video ng mga humabol na rider",Real
Mga Pinoy mas bet makatanggap ng cash bilang regalo sa Pasko – survey,Real
"Driver's license ng rider na may bata sa loob ng delivery box, sinuspinde ng LTO",Real
"CAAP, hindi pa rin natatagpuan ang nawawalang Cessna airplane sa Isabela",Real
"AFP, wi-nelcome ang plano ng Pilipinas na lumikha ng VFA kasama ang Japan",Real
OFW sugatan matapos takasan ang kanyang employer sa Kuwait,Real
DOTr Sec. Tugade umalma sa malisyosong artikulo tungkol sa ‘offshore investment’,Real
Puerto Galera mayor: Linawin ng DOH at DENR ang mga lugar na bagsak ang kalidad ng tubig,Real
"Datos sa PNP, NBI, BIR, CSC na-hack: cybersecurity firm",Real
"Outbound passengers sa mga pantalan, umaabot sa 15,000",Real
24 transgender mula sa Asya maglalaban sa model search,Real
"Inflation rate sa bansa, inaasahang mananatiling mataas",Real
"Pangulong Marcos, bukas na ipagpatuloy ang post-quake assistance ng Pilipinas sa Syria",Real
"PBBM, nakatakdang dumalo sa PMA Alumni Homecoming",Real
Depensa ni Jonvic Remulla sa pamimigay ng pera sa Uniteam sortie: BBM was not mentioned,Real
"Tricycle driver at pasahero, patay nang salpukin ng SUV na minamaneho ng 18-anyos na estudyante sa Caloocan",Real
Zubiri aminadong mahihirapang itulak ang cha-cha kung walang suporta ni PBBM,Real
Bong Go: BI dapat nang imodernisa vs korapsyon,Real
"Mayor sa Maguindanao, sugatan sa ambush sa Pasay City",Real
"Taxi driver na tumangay sa cellphone ng isang foreigner na nagpakita ng destination address, huli",Real
"Makati, Manila, Parañaque, Pasay walang tubig hanggang March 7 – Maynilad",Real
"6-anyos na batang babae sa Maynila, hinostage ng sariling ama",Real
"NCPO, naka Full Alert Status sa pagdating ni PBBM ngayong araw",Real
"Hepe ng San Miguel, Bulacan patay sa engkwentro, alok na pabuya umabot na sa P1.2-M",Real
Defensor nag-aalok ng kooperasyon kay Belmonte laban sa COVID,Real
Gobyerno hinimok na mamuhunan sa kalusugan,Real
"Farmers’ group, hiniling sa mga senador na huwag madaliin ang ratipikasyon ng RCEP",Real
"12 nalunod nitong Holy Week, karamihan patay –police report",Real
"Mayor Belmonte, hinuli dahil sa hindi pagsusuot ng helmet habang nagbibisikleta",Real
Apela na extension ng SIM registration pinag-aaralan pa,Real
"Kuweba, waterfalls ilan sa bagong atraksiyon sa Opol, Misamis Oriental",Real
#NamamaskoPo: Pasig City nag-umpisa nang mamigay ng Christmas food packs,Real
Rep. Teves naispatan sa South Korea,Real
"LTFRB naglabas ng isang memorandum na tutugon sa sexual harassment ng mga PUV operators, drivers, at iba pa nilang empleyado",Real
"3,992 sa 9,183 examinees nakapasa sa Bar Exam",Real
Kick off ng isang linggong transport strike may minimal effect lang sa mga commuters – MMDA,Real
"PBA, DILG magsasanib-puwersa para sa kampanya kontra droga",Real
Deadline ng SIM card registration dapat palawigin ng 1 o 2 buwan – Solon,Real
"Quezon City terminal, ginalugad ng LTO NCR",Real
"Marcos, Biden nakatakdang magpulong sa Mayo 1",Real
"CA, idineklarang valid ang search warrants na inisyu ng Manila RTC laban sa mga opisyal at miyembro ng KAPA",Real
"Government officials na walang ambag sa Pinas, sibakin na!",Real
"Ruffa may nadiskubre kay Ferdinand Marcos, Sr.: He’s very romantic pala, nakita ko yung love letters niya kay Madam Imelda",Real
Marcos inatasan ng CHED na tugunan ang kakulangan ng mga nurses sa bansa,Real
DOJ chief Remulla sa mga natagpuang kalansay: A probable archaeological site…this might be war time,Real
"Makabayan bloc, naghain ng resolusyon para ipanawagang bawiin ang government’s terrorist tag sa mga rebeldeng komunista",Real
"Self-confessed gunman ni Percy Lapid, inilipat na sa Camp Crame",Real
Pagpaparehistro ng SIM nagsimula na; Anu-ano nga ba ang dapat gawin?,Real
Mensahe ni PBBM ngayong Semana Santa: Maging daan tungo sa pagbabago at tagapaghatid ng katotohanan,Real
"P27.9-M jackpot prize ng 6/49 Super Lotto, napanalunan",Real
Gobyerno naghahanda sa repatriation ng nasa 300 mga Pinoy sa Sudan,Real
Viral TikTok video ng isang guro iimbestigahan ng DepEd,Real
Ama ng suspek sa Ateneo shooting patay matapos barilin sa Basilan,Real
"4, kinasuhan sa chop-chop murder case ng model na si Abby Choi sa Hong Kong",Real
"Duterte: Mga ayaw magpa-bakuna kontra COVID-19, turukan habang natutulog",Real
"Health workers nainsulto sa pagtalaga kay Camilo Cascolan bilang Usec ng DOH, anyare?",Real
"Dating mayor ng Bayambang, Pangasinan pumanaw na",Real
"WATCH: Nagpuyat, nagtiyaga ng ilang oras sa pila para sa ayuda",Real
Deadline ng ITR filing sa Abril 17 wala nang extension,Real
"DPWH magpapatupad ng 70,000 mga proyekto ngayong taon",Real
Lahat ng klase ng ‘pagsusugal’ naka-ban na sa Pasig,Real
"8,241 pumasa sa 2020/2021 Philippine Bar exams",Real
"Mga insidente ng pagkalunod, dumami ngayong Semana Santa",Real
Mga namamalimos na Badjao sa NCR kumikita ng P5k kada araw – DSWD,Real
"Mag-live in partner, huli nang ibudol umano ang isang menor de edad na bumili sa kanila ng CP online",Real
"Pope Francis may bininyagan sa ospital kahit nagpapagaling pa, posibleng ma-discharge ngayong April 1",Real
"Canadian PM Justin Trudeau at asawa, nabakunahan na kontra Covid-19",Real
Job opportunity: Bandera naghahanap ng social media specialist,Real
"Pagbabalik ng academic calendar, ipaubaya sa DepEd - Sen. Go",Real
Mga sakit sa puso pangunahing dahilan ng pagkamatay sa Pilipinas –PSA,Real
"Pinoy quake victim sa Turkey, na-rescue, pero may apat pang nawawala",Real
Tito Sotto naturukan na ng unang dose ng COVID-19 vaccine,Real
COVID-19 positivity rate umakyat na sa 8.8%,Real
"Health expert, inirerekomenda pa rin ang paggamit ng face shield",Real
"Market vendor umalma sa ‘no vaccine, no ride’ policy ng gobyerno",Real
"House, inibaabot na ang P5.4 million donasyon para sa mga biktima ng lindol sa Turkey",Real
"Mekaniko, patay matapos magulungan ng kinukumpuning jeep sa Makati",Real
Libo-libong Muslim sa iba't ibang parte ng bansa ipinagdiwang ang Eid'l Fitr,Real
Eleazar itinalagang PNP OIC matapos magpositibo sa Covid-19 si Sinas,Real
"Palasyo, pinabulaanan ang 2 araw na bawas sweldo sa mga gov’t employee bilang relief fund para sa Turkey at Syria",Real
"1,000 residente sa Iligan City, inilikas",Real
Higit 2K PCG personnel ikinalat sa mga pantalan,Real
"BI officer, itinanggi na hinanapan niya ng yearbook ang pasahero ng eroplano-- BI spox",Real
"Smartwatch ng pasaherong Tsino sa NAIA, naglaho sa tray;  security personnel, inaresto",Real
Pangulong Duterte mas gugustuhing mamatay kaysa humarap sa ICC,Real
KILALANIN: Celebrities na pumasa sa 2022 Bar Exams,Real
"3rd nominee ng ACT-CIS, nagbitiw sa pwesto",Real
"3 sa bansa sa Africa na nasa Covid ‘red list’, pinapayagan pa ring pumasok sa Pinas",Real
"Senate panel, inimbitahan ang ICC na harapin ang imbestigasyon kaugnay sa Duterte drug war",Real
"Gov. Mamba, tutol pa rin na isama ang Cagayan sa mga bagong EDCA site",Real
Gardo Versoza nakaramdam ng lungkot nang maisip na ‘maiiwan’ ang mag-iina niya,Real
Nursing graduate mula sa La Union hindi pinagmartsa kahit bayad sa graduation fee,Real
"20 tsuper inaresto dahil sa ‘overloading’, nanawagan ang LTFRB na sumunod sa batas",Real
"DTI, nangakong palalakasin ang kampanya laban sa pagbebenta ng ng vape at e-cigarette products",Real
PAGASA: LPA asahan sa mga susunod na araw; Hanging Amihan nagpapaulan sa bansa ,Real
Pagkakaantala sa pag-isyu ng National ID sinisi sa mga kaso ng ‘close matches’,Real
"Tag-init na panahon nagsimula na, inaasahang tatagal hanggang May –PAGASA",Real
"Bilang ng overseas Pinoy na naka-recover sa COVID-19, nasa 10,060 na",Real
"NEDA Chief, tiniyak sa publiko na walang mangyayaring privitization sa mga serbisyo ng UP-PGH",Real
"Mambabatas, pinamamadali ang pagtalakay sa pagsasagawa ng Joint maritime patrols sa WPS",Real
"2 piloto na sakay ng trainer aircraft ng Philippine Air Force, ligtas matapos magkaaberya palapag sa runway sa Batangas",Real
"Court martial vs ex-PSG chief Durante re: Davao model slay, itinakda ngayong linggo",Real
'Pahalik' pwede na uli ngayong Holy Week; tetano ibinabala vs penitensya,Real
NEA humiling ng tatlong linggo upang maresolba ang power crisis sa Occidental Mindoro,Real
Pinas ‘di kakapusin sa bigas – Pangulong Marcos Jr.,Real
"Mga solo parents malapit nang mabigyan ng diskwento at VAT-exemption sa pagbili ng gatas, gamot ng mga bata",Real
"Mag-ama, arestado nang mahulihan ng mahigit P1-M halaga ng shabu umano sa QC",Real
"PH, walang team na ipadadala sa Syria ngunit naghahanda ng mga donasyong ipadadala sa bansa",Real
Search warrants laban sa Kapa valid – Court of Appeals,Real
"Turkey-Syria quake death toll: halos 8k na; 3 Pilipino, nawawala",Real
"Wanted poster ng 6 na suspek sa 'missing sabungero’ sa Manila Arena, inilabas na",Real
"Mga mall, gov't building, nais ng mambabatas na lagyan ng prayer room para sa mga Muslim",Real
Teves muling hinamon ni Remulla na umuwi ng bansa at harapin ang mga akusasyon laban sa kanya,Real
Chinese ambassador 'misquoted' umano sa pahayag tungkol sa OFWs,Real
"2 magkaibigan na nagpanggap na nangangalakal, huli nang maaktuhang nagnanakaw ng tricycle sa QC",Real
"Tinatayang 245 PDLs, nakatakdang palayain ng BuCor",Real
"56 OFWs na nasa death row sa ­Malaysia, may pag-asang masagip",Real
"Tumaya sa lotto mula sa Bulacan, ika-5 naka-jackpot sa loob ng 1 linggo",Real
Pinay teen nilait-lait dahil sa kanyang first ‘luxury bag’: An 80$ bag may not be a luxury but for me and my family it is a lot,Real
"Manny Villar, pinakamayamang Pinoy, batay sa Forbes&rsquo; Billionaires List 2023",Real
"Jollibee, sumuko na nga ba sa McDo?",Real
"LPA posibleng pumasok na sa bansa, nagpapaulan sa Visayas at Mindanao",Real
April 21 idineklarang ‘regular holiday’ bilang pagdiriwang ng Eid’l Fitr,Real
"15,000 doses ng Sputnik V darating na sa bansa sa Mayo 1",Real
Miranda haharapin ang reklamo  sa tamang korte – abogado,Real
"Zebra, nagpatakbo-takbo sa komunidad matapos makawala sa zoo sa South Korea",Real
"Fixers sa labas ng LTO, inalok ang mismong LTO chief na nagpanggap na kukuha ng lisensiya",Real
Rodante Marcoleta nag-withdraw sa pagtakbong senador,Real
"Marcos, pinuri ang paglalagak ng pamumuhunan ng Japanese energy giant sa bansa",Real
KILALANIN: Kauna-unahang visually impaired na abogado sa PH,Real
"Partner welfare home, binisita ng PCSO chair",Real
"LGUs, magkakaroon ng awtonomiya sakaling maipatupad na ang full devolution",Real
Korte ipinaaaresto si Bantag sa pagkamatay ng 'middleman' sa Lapid murder,Real
"Mambabatas, hiniling ang urgent review ng lahat ng labor agreements ng Pilipinas",Real
"Super powers, hindi na kailangan ni Pangulong Bongbong Marcos dahil kaya na umano nitong magdekalara ng emergency at kontrolin ang presyuhan ng mga bilihin",Real
2 patay sa magkasunod na ‘hit-and-run’ incident,Real
Klase sa ilang lugar sa bansa suspendido pa rin dahil sa sama ng panahon,Real
Isang gabing curfew at ang kwentong lumugaw sa utak ng mga Pilipino,Real
"3,000 sundalo mula sa Philippine, US Army nakikibahagi ngayon sa taunang Salaknib Exercise",Real
"'Amang' naging LPA na lang, pauulanin Metro Manila",Real
House panel inendorso sa plenaryo ang panukalang magpo-protekta sa publiko laban sa mga scammer,Real
LPA nakapasok na sa loob ng PAR,Real
"Ilang Senador, kinuwestyon kung bakit ipinipilit na China ang ka-deal ng Pilipinas sa WPS exploration",Real
"Dating PBA player na si Boybits Victoria, pumanaw na",Real
Bongbong Marcos idineklara na bilang ika-17 pangulo ng Pilipinas,Real
"Tolentino, nanawagan sa DFA na maging maingat sa bagong exploratory talks sa China",Real
Top 2 passers ng 2022 bar exams magkasama sa law firm,Real
Ka Leody sa pagkakaaresto ng ka-tandem noong eleksyon: Palayain si Walden Bello!,Real
Miyembro ng Abu Sayyaf Group natimbog ng NBI sa Quezon City,Real
"Listahan ng 10K OFWs para sa Saudi Gov’t claim, isusumite ng DMW bago ang May 1",Real
"Brownlee, nagpakawala ng 41 puntos; pero Gilas, kinapos vs Jordan",Real
PMGen. Benjamin Acorda Jr. bagong PNP Chief,Real
"Imbestigasyon sa Degamo slay case, nagiging perya na – Teves",Real
"1 sa mga suspek sa pagpatay kay Gov. Degamo, nagtrabaho dati sa isang kongresista at sinibak dahil sa droga",Real
NFA 'di mag-aangkat ng bigas para sa buffer stock: DA,Real
"#NamamaskoPo: QC, Manila, Makati namigay na rin ng Christmas food packs",Real
6 Pinoy nakatakas sa sindikato ng love scam,Real
Umano'y gunman sa Lapid case nakatakdang ilipat sa Crame,Real
"Remulla tiwalang maaaresto sina Bantag, mga dawit sa Lapid case",Real
Mahigit 64k na mga pasahero dinagsa ang mga pantalan ngayong Biyernes Santo –PCG,Real
Pinsala ng Mindoro oil spill posibleng pumalo ng P1 bilyon,Real
"Pangulong Marcos, ideneklara ang Feb. 24 bilang special non-working day",Real
Mas maraming Pinoy ready nang mamasyal ulit ngayong summer –survey,Real
Tolentino iginiit na panagutin ang may ari ng oil tanker na nagdulot ng oil spill sa Mindoro,Real
BIR offices 'di dinagsa sa huling araw ng ITR filing,Real
"Gender equality sa trabaho , ibinida ng CSC sa pagtatapos ng National Women’s Month",Real
"5 ‘isnaberong’ taxi driver inaresto ng LTO, iba pang tsuper binalaan",Real
"Trabaho, oportunidad sa bagong TNVS slots",Real
Babala ni Gen. Eleazar kay Jake: Titiyakin kong mananagot ka sa pambabastos mo sa batas…,Real
2 Pinoy patay sa 7.8 magnitude na lindol sa Turkey,Real
"Resolusyong nagsusulong ng pagbuo ng con-con, pasado na sa Kamara",Real
Paghahanap sa nawawalang Cessna plane sa Isabela inihinto muna,Real
Ilang transport groups hindi makikiisa sa isang linggong transport strike,Real
"Bantag, iba pang akusado sa Percy Lapid case maituturing na 'fugitives': PNP",Real
"Special Task force, binuo na ng DOJ para imbestigahan ang nasa 20 kaso ng pagpatay sa Negros Oriental",Real
Paolo Contis inaming may mga nagawang pagkakamali kay LJ Reyes: ‘Pero marami pang hindi alam ang tao’,Real
#LongWeekendAnnouncement: Mga dapat malaman ngayong Undas 2022,Real
"Medical corps ng AFP, PNP ipinahahanda para sa deployment dahil sa pagdami ng health workers na tinamaan ng COVID-19",Real
"DA, naglaan ng mahigit P177M para pigilan ang bird flu",Real
"Lalaki, inireklamo ng kanyang 3 stepdaughters dahil sa umano'y pangmomolestiya",Real
"Isang programa, inilunsad ng LTO upang mas mabilis na makapagreklamo ang publiko sa serbisyo ng ahensiya",Real
Taripa sa ilang imported na produkto ibababa,Real
Palawan bumandera bilang ‘Most Desirable Island’ sa isang UK magazine,Real
"Na-detect na Omicron subvariant XBB.1.5, hindi magpapataas sa mga kaso ng COVID-19 – Solante",Real
"Pagbabalik ng bakasyon ng mga estudyante sa buwan ng Abril hanggang Mayo, hirit ng isang Senador",Real
NWorld buking sa illegal ‘investment scheme’ ng beauty and skin care products,Real
Taguig may ‘libreng sakay’ kasabay ng transport strike sa March 6-12,Real
Pilipinas itinanghal na world’s leading beach at dive destinations,Real
"Lalaki, inaresto matapos umanong saktan at tutukan ng baril ang live-in partner, anak sa QC",Real
Negros Island bill pasado na sa 2nd reading sa Kamara,Real
"Malacañang may pa-concert kada 3 buwan, ang unang pagtatanghal ‘dedicated’ sa AFP",Real
"Clarita Carlos binatikos matapos magkomento sa Bar exam passers: We need more scientists, engineers, doctors, not more lawyers!",Real
"Habambuhay na pagkakulong, P5M multa para sa mga bank hackers–Defensor",Real
TokTok kinilalang 2022 Transport App of the Year sa VP Choice Awards,Real
"7 freelance models, nasagip matapos ipain sa sex trafficking; babaeng bugaw umano, arestado",Real
"Bagyong Rosal lalo pang lumakas, pero wala namang epekto sa bansa",Real
"Oil spill sa Oriental Mindoro patuloy na kumakalat, 24k ektarya ng coral reef ‘nanganganib’",Real
"Senate panel, sisimulan na probe sa human smuggling sa NAIA gamit ang private plane",Real
Abril 21 idineklarang regular holiday para sa Ramadan,Real
"Top earners ng House of Franchise, JC franchises pinarangalan sa ‘Gathering of the Stars’",Real
"Lalaki, arestado sa kasong pagnanakaw; kasintahan, huli rin dahil sa droga at 'pambubugaw'",Real
Pamilya Marcos magiging ‘simple’ lang daw ang mga aktibidad para sa Semana Santa,Real
Ex-partylist solon inaresto,Real
Prince Chales taus-puso ang pasasalamat sa Pinoy health care workers sa UK,Real
MT Princess natuklasang isang scrap ship at dalawang beses na ginawa upang maging isang tanker,Real
Bridgerton spin-off 'Queen Charlotte' mapapanood sa Mayo,Real
DOH nagpaalala sa posibleng epekto ng El Niño sa kalusugan,Real
"Pantalon na nagiging airbag, dagdag-proteksyon sa riders kung sakaling sumemplang sa kalsada",Real
Brunei patuloy ang suporta sa ‘peace process’ sa Mindanao ,Real
"State prosecutors, tinapos na ang preliminary investigation sa murder complaints na isinampa laban kay Bantag",Real
"SIM registration, ‘di inaasahang 100% - NTC",Real
Isko Moreno umaasang susuportahan ni Duterte matapos umatras si Go,Real
"Umano'y gunman sa pagpatay kay Percy Lapid, humingi ng tawad",Real
"P9,000 hazard pay para sa healthcare workers, ihinihirit",Real
PH nakatakdang magbigay ng humigit-kumulang PHP11 milyon financial aid sa Syria,Real
2 PNP generals at 8 iba pa pinapag-leave of absence ng DILG dahil sa massive cover-up sa drug case ni Police Msgt. Mayo,Real
PNP chief handang ipaliwanag ang ‘cover up’ sa Senado,Real
"PAGASA nagbabala sa malakas na epekto ng hanging amihan, LPA inaasahang malulusaw",Real
"Pagtugis sa shooting suspects sa Antipolo, nauwi sa drug bust",Real
"Japanese Embassy, pinasalamatan si Remulla sa deportation ng apat na Japanese fugitives",Real
"Speaker Romualdez: Rep. Teves, ayaw umuwi dahil nangangamba sa kaligtasan",Real
"Robin Padilla nabwisit sa ‘barumbadong’ opisyal ng DFA: Senador ako, respetuhin mo ‘ko",Real
"Paghahain ng COC para sa BSKE, inilipat ng Comelec sa buwan ng Agosto mula Hulyo",Real
"2 talunan sa bilyar, namaril sa bilyaran sa Brazil; 6, patay",Real
"145 estudyante naospital, nahilo sa matinding init",Real
"DOTr nais magtaas ng pasahe sa MRT at LRT, ilang grupo pumapalag: ‘Dapat makiramdam naman ang ahensya…’",Real
"Lalaki binaligtad ang watawat ng Pilipinas sa NAIA, inaresto",Real
Paalala ng Immigration sa lahat ng biyahero: Ihanda na ang lahat na kailangang dokumento,Real
Mambabatas nanawagan sa mabilis na aksyon ng gobyerno sa mga kaso ng 83 Pinoy na nasa death row,Real
Public schools sa Metro Manila balik face-to-face classes; wala nang ‘Libreng Sakay’,Real
"Cancer survivor, nanalo ng P50 milyon sa lotto",Real
DOH hinimok na palakasin ang pagtugon sa mga sakit na posibleng makuha sa mainit na panahon,Real
"Registered voters para sa BSKE , mahigit 2M hanggang Jan 28 – Comelec",Real
Pagpapalawak ng E-travel system umarangkada na,Real
"3 kilo ng hinihinalang cocaine na pinagmukhang sabon, nasabat sa NAIA",Real
"P20M bayad sa isang tribung maaapektuhan ng konstruksyon ng Kaliwa Dam, pinaiimbistigahan",Real
"Big-time oil price hike, lalarga sa Martes",Real
Bagong omicron subvariant na XBB.1.16 binabantayan,Real
"30 araw na fully paid paternity leave kahit hindi kasal, isinusulong sa House",Real
33 sugatan sa pagtaob ng cargo van sa Quezon,Real
"Defensor, Castelo naghain ng P17B recovery roadmap para sa Quezon City",Real
DILG: May gustong mag-cover-up sa imbestigasyon ng P6.7-B nasabat na shabu,Real
"5-man panel ng DILG, kumpleto na",Real
"Natenggang dagdag sa generation charge, ipapasa sa mga konsumer",Real
"PH may sapat na pondo para masakop ang pagpapauwe ng 150,000 OFWs sa Taiwan",Real
6 ahensya pumabor sa TOP-CRMS vs mataas na logistics cost – PPA,Real
Envi group nagbabala na posibleng maramdaman ng ilang dekada ang pinsalang dulot ng oil spill sa Mindoro,Real
"DepEd: Bawal maging ‘friends’ ang guro, estudyante sa labas ng klase",Real
"Rendon Labador ipinagtanggol si Vice: ‘Kayong mga tao ‘di porket bumili kayo ng ticket sa isang show, eh, parang nabili n’yo na ang mga artist’",Real
Marcos pinangunahan ang pagpapasinaya sa mga proyektong pabahay,Real
"Cebu Pacific nag-sorry kay VP Leni, piloto inaming walang basehan ang viral post",Real
‘Magparehistro na ng SIM cards’ - DICT,Real
"Bongbong, Sara nangunguna sa bilangan; Robin No. 1 sa labanan ng mga senador",Real
"Party-list system, gustong 'gibain' ni Padilla kapag natuloy ang Cha-cha",Real
OCTA: COVID-19 cases per week sa Metro Manila tumaas ng 56%,Real
Eid'l Fitr isasagawa sa Abril 22,Real
"Kaso ng dengue sa bansa, tumaas ng  69% mula January 1 hanggang 28 ayon sa DOH",Real
DOT: nakakuha ang Pilipinas ng dalawang nominasyon sa 2023 World Travel Awards,Real
"Ambulansya at SUV, nagkabanggaan sa Maynila",Real
"Lalaki, inireklamo ng sextortion ng kaniyang nobya; suspek, iginiit na naniningil lang ng utang",Real
PNP tinukoy na ang 5 suspek sa isa pang hazing incident na ikinasawi ng isang estudyante ng University of Cebu,Real
"BI, idinepensa ang mahabang interview sa mga bibiyahe na minsan ay dahilan para maiwan ng eroplano",Real
"PBBM, inihayag na maganda ang takbo ng ekonomiya ng bansa at nakabangon na mula sa pandemya",Real
"Voter registration, paglabas ng Voter’s Certificate balik na sa NCR plus simula sa May 17",Real
"Babaeng wanted dahil umano sa panloloko, nabisto dahil sa talbog na tseke",Real
63 manok tigok matapos atakehin sa puso dahil sa maingay na banda,Real
WATCH: 14 milyong katao nabakunahan na laban sa Covid-19,Real
"Apollo Quiboloy ‘wanted’ sa FBI, dalawa pang miyembro pinaghahahanap rin",Real
"PAGASA: Asahan ang malamig, maulang Pasko; Ilang domestic flights kanselado",Real
Marcos nakakuha ng ‘very good’ net satisfaction rating sa pinakabagong SWS survey,Real
"Person of interest sa Salilig hazing case, natagpuang patay",Real
Kailangan ng puhunan at pantawid sa gastos? Mas pinadali at pinagaan ang paghiram ng pera sa GCash,Real
Dito Telecom walang pakinabang sa maraming Pilipino – ICT advocacy group,Real
